{
  "id": "123-София",
  "name": "Мебелно - Враца",
  "date": "2026-09-10",
  "created_by": "Примерен диспечер",
  "note": "Първи курс, изпълнение до 10:00; задължително прозвъняване на всички получатели поне час преди доставка",
  "orders": [
    {
      "client": "Примерна мебелна къща ООД",
      "company_phone": "08XX XXX XXX",
      "warehouse_order": "5500664689",
      "invoice": "6000664689",
      "recipient": "Примерен получател 01",
      "recipient_phone": "08XX XXX XXX",
      "address": "София, ул. Примерна 10, склад 1",
      "product_count": 5,
      "client_id": "customer-001"
    },
    {
      "client": "Примерна мебелна къща ООД",
      "company_phone": "08XX XXX XXX",
      "warehouse_order": "5500664690",
      "invoice": "6000664690",
      "recipient": "Примерен получател 02",
      "recipient_phone": "08XX XXX XXX",
      "address": "София, ул. Примерна 12, склад 2",
      "product_count": 12,
      "client_id": "customer-001"
    },
    {
      "client": "Примерна мебелна къща ООД",
      "company_phone": "08XX XXX XXX",
      "warehouse_order": "5500664691",
      "invoice": "6000664691",
      "recipient": "Примерен получател 03",
      "recipient_phone": "08XX XXX XXX",
      "address": "София, бул. Примерен 85, вход Б",
      "product_count": 8,
      "client_id": "customer-001"
    },
    {
      "client": "Примерен интериор ЕООД",
      "company_phone": "08XX XXX XXX",
      "warehouse_order": "5500664692",
      "invoice": "6000664692",
      "recipient": "Примерен получател 04",
      "recipient_phone": "08XX XXX XXX",
      "address": "Ботевград, Примерна индустриална зона, сграда 3",
      "product_count": 3,
      "client_id": "customer-002"
    },
    {
      "client": "Примерен интериор ЕООД",
      "company_phone": "08XX XXX XXX",
      "warehouse_order": "5500664693",
      "invoice": "6000664693",
      "recipient": "Примерен получател 05",
      "recipient_phone": "08XX XXX XXX",
      "address": "Мездра, ул. Примерна 7, партер",
      "product_count": 16,
      "client_id": "customer-002"
    },
    {
      "client": "Примерен клиент ООД",
      "company_phone": "08XX XXX XXX",
      "warehouse_order": "5500664694",
      "invoice": "6000664694",
      "recipient": "Примерен получател 06",
      "recipient_phone": "08XX XXX XXX",
      "address": "Враца, бул. Примерен 24, складова база",
      "product_count": 7,
      "client_id": "customer-003"
    }
  ]
}
